"作物","栽培形態","月","作業","施肥_種類","N(g)","P(g)","K(g)","施肥基準","施肥_メモ","薬剤"
"パッションフルーツ","鉢植え","8","果実肥大〜熟期。置き肥を追施。","緩効性・置き肥・少量","3.0","2.0","3.0","鉢(10号)","受粉後は肥料切れに注意。",""
"パッションフルーツ","鉢植え","9","収穫。回復に軽い追肥。","緩効性・置き肥・少量","2.0","1.0","2.0","鉢(10号)","落果してから追熟。",""
"パッションフルーツ","鉢植え","10","収穫後整理・軽剪定。越冬準備を段階的に。","","0.0","0.0","0.0","鉢(10号)","夜間冷え込みに注意。","保護殺菌剤（斑点・炭疽）"
"パッションフルーツ","鉢植え","11","室内取り込みの準備。剪定と誘引材の撤去。","","0.0","0.0","0.0","鉢(10号)","室内は明るく風通しよく。",""
"パッションフルーツ","鉢植え","12","室内管理・防寒徹底。潅水は控えめに維持。","","0.0","0.0","0.0","鉢(10号)","根鉢を冷やさない。",""
"ラズベリー","地植え","1","前年結実枝を株元から更新剪定。枯葉・病葉の除去。支柱・誘引線の点検。","","0.0","0.0","0.0","地植え・成木（株当たり。量は別表）","密生を避けて風通し確保。","冬季：石灰硫黄合剤等（適用外の品種は使用不可）"
"ラズベリー","地植え","2","元肥（控えめ）。株間の吸芽を調整し更新株を選抜。","有機主体の元肥（控えめ）","0.0","0.0","0.0","地植え・成木（株当たり。量は別表）","過湿地は盛り土・排水溝で改善。",""
"ラズベリー","地植え","3","新芽展開。霜害・風害対策。草勢の偏りを確認。","","0.0","0.0","0.0","地植え・成木（株当たり。量は別表）","過繁茂は小果化につながる。",""
"ラズベリー","地植え","4","不要芽・弱い新梢の間引き。株元の清掃とマルチ補充。","","0.0","0.0","0.0","地植え・成木（株当たり。量は別表）","マルチは過湿にならない厚さに。","うどんこ：硫黄系／灰色かび：保護殺菌剤"
"ラズベリー","地植え","5","開花期の整枝・誘引。鳥害対策の準備。","","0.0","0.0","0.0","地植え・成木（株当たり。量は別表）","蜜源として昆虫が増えるので観察を強化。","アブラムシ：選択性殺虫剤"
"ラズベリー","地植え","6","結実肥大期。水分管理を丁寧に。株元の風通し確保。","","0.0","0.0","0.0","地植え・成木（株当たり。量は別表）","地表灌水は朝中心。",""
"ラズベリー","地植え","7","収穫最盛〜終了。収穫後に結実枝を地際で切除。","","0.0","0.0","0.0","地植え・成木（株当たり。量は別表）","来季結果用の新梢を保護。","ハダニ：ダニ剤／ショウジョウバエ対策：衛生管理"
"ラズベリー","地植え","8","新梢育成期。追肥は控えめに施す。","緩効性・少量追肥","0.0","0.0","0.0","地植え・成木（株当たり。量は別表）","窒素過多は徒長・軟弱。",""
"ラズベリー","地植え","9","新梢充実。株間整理と誘引。","","0.0","0.0","0.0","地植え・成木（株当たり。量は別表）","越冬芽の位置を確認。",""
"ラズベリー","地植え","10","秋の緩効性肥料を控えめに。落葉病斑の発生は葉の除去で衛生管理。","緩効性・控えめ","0.0","0.0","0.0","地植え・成木（株当たり。量は別表）","冬の過湿防止のためマルチを薄く維持。","保護殺菌剤（斑点・炭疽）"
"ラズベリー","地植え","11","落葉前後の枯葉処理と株元清掃。","","0.0","0.0","0.0","地植え・成木（株当たり。量は別表）","害虫越冬場所を減らす。",""
"ラズベリー","地植え","12","寒冷地は防寒（霜柱・根上がり防止）。資材整備。","","0.0","0.0","0.0","地植え・成木（株当たり。量は別表）","排水第一。",""
